{
  "$schema": "https://json-schema.org/draft/2020-12/schema",
  "$id": "iy.3d_pov_render_ready/v1",
  "title": "Improve Yourself 3D POV Render-Ready Preparation V1",
  "type": "object",
  "additionalProperties": false,
  "required": ["schema", "map_id", "purpose", "canonical_runtime", "map_geometry", "assets", "semantic_mapping", "camera_policy", "environment", "collision_visibility", "dynamic_objects", "floor_policy", "fallbacks", "reference_scene", "licensing", "verification"],
  "properties": {
    "schema": {"const": "iy.3d_pov_render_ready/v1"},
    "map_id": {"const": "de_anubis"},
    "purpose": {"const": "renderer_preparation_only"},
    "canonical_runtime": {"type": "object"},
    "map_geometry": {"type": "object"},
    "assets": {"type": "array", "minItems": 4},
    "semantic_mapping": {"type": "string"},
    "camera_policy": {"type": "string"},
    "environment": {"type": "string"},
    "collision_visibility": {"type": "object"},
    "dynamic_objects": {"type": "string"},
    "floor_policy": {"type": "string"},
    "fallbacks": {"type": "array", "minItems": 1},
    "reference_scene": {"type": "string"},
    "licensing": {"type": "object"},
    "verification": {"type": "object"}
  }
}
